{
  "id": "policy-perfect-exam",
  "name": "Perfect Exam",
  "description": "Assume every exam and audition score reaches the theoretical maximum.",
  "examScoreAssumption": {
    "mode": "perfect",
    "scoreRate": 1
  },
  "scoring": {
    "baseCardWeight": 1,
    "trainingWeight": 1.25,
    "examWeight": 1,
    "synergyWeight": 1,
    "stageFitWeight": 1
  }
}
